{
  "schema": 1,
  "_meta": {"source":"maxpreps","url":"https://www.maxpreps.com","asOf":null},
  "state": "CA",
  "season": "2025-26",
  "games": [
    {"id":"54d27944-bc5c-4596-9d09-33376195c884","state":"CA","competition":"ca-cif-state","division":"gd1","divisionLabel":"Division 1","gender":"girls","round":0,"roundName":"Round I","date":"2026-03-03","status":"final","decidedBy":null,"winner":"bottom","top":{"id":"65b614fd-d453-4103-b2c8-74b5aa558661","name":"Gregori","seed":1,"score":0},"bottom":{"id":"f62e70f3-0c88-4711-9e52-3e9e132006b3","name":"Carondelet","seed":8,"score":2}},
    {"id":"87ebf79d-3e96-4f2b-ae0b-64cb5db0a474","state":"CA","competition":"ca-cif-state","division":"gd1","divisionLabel":"Division 1","gender":"girls","round":0,"roundName":"Round I","date":"2026-03-03","status":"final","decidedBy":null,"winner":"bottom","top":{"id":"de6d3780-e8f6-4a2a-93f2-b5d89499f9b0","name":"Saint Francis","seed":4,"score":1},"bottom":{"id":"54ef2b21-237c-4544-804f-af1d8e056c2b","name":"Buchanan","seed":5,"score":2}},
    {"id":"117b0ee0-3a84-45c1-bbab-20cd836a50eb","state":"CA","competition":"ca-cif-state","division":"gd1","divisionLabel":"Division 1","gender":"girls","round":0,"roundName":"Round I","date":"2026-03-03","status":"final","decidedBy":null,"winner":"top","top":{"id":"bdb0b593-ef7f-4c69-8c2a-e0a48c934ca7","name":"Los Gatos","seed":3,"score":3},"bottom":{"id":"7e4752b7-5373-46d5-a866-aaee7b1eb0c5","name":"Vacaville","seed":6,"score":1}},
    {"id":"112e3aff-b7bf-42f3-88f2-e0b0bd589fa9","state":"CA","competition":"ca-cif-state","division":"gd1","divisionLabel":"Division 1","gender":"girls","round":0,"roundName":"Round I","date":"2026-03-03","status":"final","decidedBy":null,"winner":"top","top":{"id":"f8a146fc-198e-4220-b0fc-ee145a8a81d9","name":"Bishop O'Dowd","seed":2,"score":4},"bottom":{"id":"21c1edbb-4233-47ff-8f5a-70857a366328","name":"Rocklin","seed":7,"score":0}},
    {"id":"8e4dd3f3-3cd7-4eb7-a44b-b0aeb8b4b6d3","state":"CA","competition":"ca-cif-state","division":"gd1","divisionLabel":"Division 1","gender":"girls","round":0,"roundName":"Round I","date":"2026-03-03","status":"final","decidedBy":"pk","winner":"top","top":{"id":"ff429903-681b-4ad1-abd7-356a7492395e","name":"Santa Margarita","seed":1,"score":2},"bottom":{"id":"d39c723c-ce7f-410e-95ae-35c156df0211","name":"Roosevelt","seed":8,"score":2}},
    {"id":"7a4ad5f9-8099-4d08-b0ee-e27d1efdb5c2","state":"CA","competition":"ca-cif-state","division":"gd1","divisionLabel":"Division 1","gender":"girls","round":0,"roundName":"Round I","date":"2026-03-03","status":"final","decidedBy":null,"winner":"top","top":{"id":"68a421c5-cca9-497e-8645-2049ebc86149","name":"Cleveland","seed":4,"score":2},"bottom":{"id":"64933a7c-b8f1-4d59-96f6-c22658ba76e3","name":"Redondo Union","seed":5,"score":0}},
    {"id":"310df169-8fe7-4756-bf36-a0860dc20770","state":"CA","competition":"ca-cif-state","division":"gd1","divisionLabel":"Division 1","gender":"girls","round":0,"roundName":"Round I","date":"2026-03-03","status":"final","decidedBy":null,"winner":"bottom","top":{"id":"688ec7f8-2985-4e7e-900a-4d78f845b197","name":"Mt. Carmel","seed":3,"score":0},"bottom":{"id":"75b3c4b6-a228-4423-a670-32f9396be309","name":"Oaks Christian","seed":6,"score":1}},
    {"id":"07dc586f-73a3-483e-b00e-710b6b2871f7","state":"CA","competition":"ca-cif-state","division":"gd1","divisionLabel":"Division 1","gender":"girls","round":0,"roundName":"Round I","date":"2026-03-03","status":"final","decidedBy":null,"winner":"top","top":{"id":"2b6b45d3-4465-4750-ba48-a273b674e37c","name":"Mater Dei","seed":2,"score":5},"bottom":{"id":"ff3dcd2f-cdea-46e6-accf-fd929c0a4374","name":"San Marcos","seed":7,"score":0}},
    {"id":"19d8e549-a715-4b07-81f3-bee7e270dcaf","state":"CA","competition":"ca-cif-state","division":"gd2","divisionLabel":"Division 2","gender":"girls","round":0,"roundName":"Round I","date":"2026-03-03","status":"final","decidedBy":null,"winner":"bottom","top":{"id":"288ca10d-8448-41e9-b26e-463df226b8c8","name":"Davis Sr.","seed":1,"score":2},"bottom":{"id":"a34f251c-c120-40b8-b1ef-d17d0e8baa69","name":"Las Lomas","seed":8,"score":3}},
    {"id":"e9907d4e-b5e8-46ac-bedf-4818161b024e","state":"CA","competition":"ca-cif-state","division":"gd2","divisionLabel":"Division 2","gender":"girls","round":0,"roundName":"Round I","date":"2026-03-03","status":"final","decidedBy":"pk","winner":"top","top":{"id":"0f63870a-34f3-4d5b-9dbf-653c8410f969","name":"Archbishop Mitty","seed":4,"score":0},"bottom":{"id":"db693a74-09e7-4f63-982b-d3cbb3cf138a","name":"Amador Valley","seed":5,"score":0}},
    {"id":"84359eba-6081-432b-a38e-c336f6310980","state":"CA","competition":"ca-cif-state","division":"gd2","divisionLabel":"Division 2","gender":"girls","round":0,"roundName":"Round I","date":"2026-03-03","status":"final","decidedBy":null,"winner":"top","top":{"id":"ad47af1b-1b44-42d7-ac0e-a495ff09a7e7","name":"Cardinal Newman","seed":3,"score":2},"bottom":{"id":"1dc4836b-4daf-4573-b525-27b474bd5366","name":"St. Ignatius College Preparatory","seed":6,"score":0}},
    {"id":"975c23b0-5af5-4f67-bcba-63385e21c8f7","state":"CA","competition":"ca-cif-state","division":"gd2","divisionLabel":"Division 2","gender":"girls","round":0,"roundName":"Round I","date":"2026-03-03","status":"final","decidedBy":"pk","winner":"bottom","top":{"id":"d6e80050-eb7a-4461-b54a-ccb18581c77c","name":"Vista del Lago","seed":2,"score":1},"bottom":{"id":"594e7f5d-3e25-480c-bc2c-c15cbf09c737","name":"San Ramon Valley","seed":7,"score":1}},
    {"id":"91e34ecf-d439-43c7-9b68-28db2b657306","state":"CA","competition":"ca-cif-state","division":"gd2","divisionLabel":"Division 2","gender":"girls","round":0,"roundName":"Round I","date":"2026-03-03","status":"final","decidedBy":null,"winner":"bottom","top":{"id":"86009247-6ae1-40e1-acfa-58c200528743","name":"Newport Harbor","seed":1,"score":0},"bottom":{"id":"9ef67997-7f5d-4899-b500-2d0b5c758105","name":"Westview","seed":8,"score":1}},
    {"id":"99d983ed-be01-4055-9c46-7323b1ca9cf8","state":"CA","competition":"ca-cif-state","division":"gd2","divisionLabel":"Division 2","gender":"girls","round":0,"roundName":"Round I","date":"2026-03-03","status":"final","decidedBy":null,"winner":"bottom","top":{"id":"4da93598-1256-4435-a5ff-9977bc572ea9","name":"Carlsbad","seed":4,"score":0},"bottom":{"id":"7f79a046-d5c4-465f-b1c4-41fe50ed8ea8","name":"Notre Dame (SO)","seed":5,"score":3}},
    {"id":"160b51f4-213e-437d-ab09-494e2f597e55","state":"CA","competition":"ca-cif-state","division":"gd2","divisionLabel":"Division 2","gender":"girls","round":0,"roundName":"Round I","date":"2026-03-03","status":"final","decidedBy":null,"winner":"top","top":{"id":"b887560d-fc7a-48c0-a962-ae7d4ada9719","name":"Garces Memorial","seed":3,"score":1},"bottom":{"id":"1fd5ff77-0482-4f19-a9c2-e03a6ef04ce8","name":"Granada Hills Charter","seed":6,"score":0}},
    {"id":"7c4f6c8b-ff48-4339-837c-f9b9173d3406","state":"CA","competition":"ca-cif-state","division":"gd2","divisionLabel":"Division 2","gender":"girls","round":0,"roundName":"Round I","date":"2026-03-03","status":"final","decidedBy":null,"winner":"top","top":{"id":"bbdfe0de-c4fd-47d5-92e2-6c51aa38f03e","name":"Westlake","seed":2,"score":1},"bottom":{"id":"78ad824a-61a0-462b-aa6f-1d5f6fb1bd5f","name":"La Costa Canyon","seed":7,"score":0}},
    {"id":"ae2faa4f-4bb4-49b3-94cf-b6474130a876","state":"CA","competition":"ca-cif-state","division":"gd3","divisionLabel":"Division 3","gender":"girls","round":0,"roundName":"Round I","date":"2026-03-03","status":"final","decidedBy":null,"winner":"top","top":{"id":"1f152b3b-38dc-4d34-b260-9663dc3006a4","name":"Salinas","seed":1,"score":1},"bottom":{"id":"7ad2b4f5-955e-4a92-ac1f-a1acced4df4b","name":"University","seed":8,"score":0}},
    {"id":"a39bbb37-f8b7-480d-bf39-83bc0bcb918a","state":"CA","competition":"ca-cif-state","division":"gd3","divisionLabel":"Division 3","gender":"girls","round":0,"roundName":"Round I","date":"2026-03-03","status":"final","decidedBy":null,"winner":"top","top":{"id":"b65f2bb9-f2be-4c6c-8d6a-4e5124351523","name":"Sonoma Academy","seed":4,"score":2},"bottom":{"id":"ebb8c443-1d2c-41d8-b859-67bce76d43b2","name":"Aptos","seed":5,"score":0}},
    {"id":"e3e948f9-320c-44cb-938e-23dc46876aee","state":"CA","competition":"ca-cif-state","division":"gd3","divisionLabel":"Division 3","gender":"girls","round":0,"roundName":"Round I","date":"2026-03-03","status":"final","decidedBy":null,"winner":"bottom","top":{"id":"8f97e676-a23c-43cf-8545-a474f732e6fb","name":"Kerman","seed":3,"score":0},"bottom":{"id":"280e003a-95fc-4ac2-a10b-a3773afe79ac","name":"Colfax","seed":6,"score":5}},
    {"id":"40c3c69c-b680-48ac-9633-ba665ab8b095","state":"CA","competition":"ca-cif-state","division":"gd3","divisionLabel":"Division 3","gender":"girls","round":0,"roundName":"Round I","date":"2026-03-03","status":"final","decidedBy":null,"winner":"top","top":{"id":"b2158563-2344-4e5d-8dbe-15762bbfde42","name":"Oakdale","seed":2,"score":1},"bottom":{"id":"8e01c2fa-4888-483f-8d26-6a45518c1bd8","name":"Pleasant Valley","seed":7,"score":0}},
    {"id":"f5f0b44b-35b1-4a58-a835-60844ec3b33e","state":"CA","competition":"ca-cif-state","division":"gd3","divisionLabel":"Division 3","gender":"girls","round":0,"roundName":"Round I","date":"2026-03-03","status":"final","decidedBy":null,"winner":"top","top":{"id":"ddf384b8-3189-4276-8703-71106d47a4d5","name":"Del Norte","seed":1,"score":4},"bottom":{"id":"f8a54c04-e88d-4bd2-831d-fd355f791540","name":"Palisades","seed":8,"score":3}},
    {"id":"cfdac75f-08f7-4979-9452-4e8f3b85d5e9","state":"CA","competition":"ca-cif-state","division":"gd3","divisionLabel":"Division 3","gender":"girls","round":0,"roundName":"Round I","date":"2026-03-03","status":"final","decidedBy":null,"winner":"top","top":{"id":"e147e259-13ce-4929-b531-c822636769c7","name":"Quartz Hill","seed":4,"score":2},"bottom":{"id":"045b97e7-41d4-4730-9279-e8cbb50636f0","name":"El Diamante","seed":5,"score":0}},